<?xml version="1.0" encoding="UTF-8"?>
<!DOCTYPE classroom SYSTEM "classroom.dtd">
 <classroom id="c1">
    <classname>计算机</classname>
    <grade>2011</grade>
    <students>
        <student>
            <id>1</id>
            <name>zhangsan</name>
            <age>12</age>
        </student>
        <student>
            <id>2</id>
            <name>lisi</name>
            <age>12</age>
        </student>
    </students>
</classroom>